title,description
College Algebra 2e with Corequisite Support,"<p data-block-key=""nwbbn""><i>College Algebra 2e with Corequisite Support</i> integrates comprehensive algebraic principles with effective foundational review. Each textbook section is paired with a thoughtfully developed, topically aligned skills module that prepares students for the course material. The modules include conceptual overviews, worked examples, and guided practice; they incorporate relevant material from OpenStax’s Developmental Math series.</p><p data-block-key=""fkvi1""><br/>To offer the most flexibility as possible, the material within <i>College Algebra 2e with Corequisite Support</i> will be available in several formats. The skills modules can be downloaded and/or printed for use in classes, workshops, or tutoring sessions, and will be provided as both Word and PDF files.</p><p data-block-key=""94u43""></p><p data-block-key=""5rf10"">The <i>College Algebra 2e with Corequisite Support</i> revision focused on improving relevance and representation as well as mathematical clarity and accuracy. Introductory narratives, examples, and problems were reviewed and revised using a diversity, equity, and inclusion framework. Many contexts, scenarios, and images have been changed to become even more relevant to students’ lives and interests. To maintain our commitment to accuracy and precision, examples, exercises, and solutions were reviewed by multiple faculty experts. All improvement suggestions and errata updates from the first edition were considered and unified across the different formats of the text. The first edition of <i>College Algebra</i> <i>with Corequisite Support</i> by OpenStax is available in web view <a href=""https://openstax.org/books/college-algebra-corequisite-support/pages/1-introduction-to-prerequisites"">here</a>.</p><p data-block-key=""rhkb""></p><p data-block-key=""c9fun"">If you have encountered a white screen while accessing your OpenStax textbook, our developers suggest closing all of your <a href=""http://openstax.org/"">OpenStax.org</a> tabs and then loading the book again.</p>"
College Physics,"<p data-block-key=""i0odq""><i>College Physics</i> meets standard scope and sequence requirements for a two-semester introductory algebra-based physics course. The text is grounded in real-world examples to help students grasp fundamental physics concepts. It requires knowledge of algebra and some trigonometry, but not calculus. <i>College Physics</i> includes learning objectives, concept questions, links to labs and simulations, and ample practice opportunities for traditional physics application problems.<br/></p>"
College Physics 2e,"<p data-block-key=""k4g94""><i>College Physics 2e</i> introduces topics conceptually and progresses through clear explanations in the context of career-oriented, practical applications, and meets the scope and sequence of an algebra-based physics course. The narrative of physics and scientific discovery has been even further expanded to focus on including more diverse contributors to the field. Building on the success of the first edition the authors have increased focus on interdisciplinary connections, including enhancements to biological and medical applications. The problem solving approach has been revised to further unify conceptual, analytical, and calculation skills within the learning process, the authors have integrated a wide array of strategies and supports throughout the text for students.</p><p data-block-key=""a10q3"">The first edition of <i>College Physics</i> by OpenStax is available in web view <a href=""https://openstax.org/books/college-physics/pages/1-introduction-to-science-and-the-realm-of-physics-physical-quantities-and-units"">here</a>.</p>"
College Physics For AP® Courses 2e,"<p data-block-key=""ow8zh""><i>College Physics for AP® Courses 2e</i> is designed to engage students in their exploration of physics and help them apply these concepts to the Advanced Placement® test. Because physics is integral to modern technology and other sciences, the book also includes content that goes beyond the scope of the AP® course to further student understanding. The AP® Connection in each chapter directs students to the material they should focus on for the AP® exam, and what content — although interesting — is not necessarily part of the AP® curriculum. This book is Learning List-approved for AP® Physics courses and meets the scope and sequence for these courses.</p><p data-block-key=""6tpu1"">The first edition of <i>College Physics for AP® Courses</i> by OpenStax is available in web view <a href=""https://openstax.org/books/college-physics-ap-courses/pages/1-connection-for-ap-r-courses"">here</a>.</p><p data-block-key=""c5unu""></p><p data-block-key=""dlb06""></p>"
College Physics with Courseware,
College Success,"<p data-block-key=""vddik"">OpenStax <i>College Success</i> is a comprehensive and contemporary resource that serves First Year Experience, Student Success, and College Transition courses. Developed with the support of hundreds of faculty and coordinators, the book addresses the evolving challenges and opportunities of today’s diverse students. Engagement, self-analysis, personal responsibility, and student support are reflected throughout the material. <i>College Success</i> also includes an array of student surveys and opinion polls, and OpenStax will regularly provide the results to adopting faculty.  </p><p data-block-key=""6vvad"">Based on OpenStax’s open (CC-BY) license and its wide array of formats, faculty may remix and reuse these elements according to their approach. OpenStax textbooks are always free online, and as a PDF.</p><p data-block-key=""47gvv"">Robust instructor ancillaries will include lecture slides, an instructor resource manual, a test bank, and other resources.</p>"
College Success Concise,"<p data-block-key=""535n7"">OpenStax <i>College Success</i> <i>Concise</i> serves First Year Experience, Student Success, and College Transition courses, and can also be used as a supplementary resource in courses across the curriculum. With the input of hundreds of instructors and academic success experts, the authors carefully prioritized the most critical topics to align to briefer courses. The offering covers material such as college culture, time management, mindset, study skills, test preparation, financial literacy, health, and planning for the future. While much of the material is very similar to the original <i>College Success</i> book, this version was holistically edited and updated. Users will see additions such as a new section on group work and greatly expanded coverage of stress management and wellbeing.</p><p data-block-key=""5f9sb"">While <i>College Success Concise</i> is a self-contained work with a logical flow and narrative, our open (CC-BY) license and multiple formats allow instructors and students to utilize content from the original <i>College Success</i> text, as well. Ancillaries such as the Instructor’s Manual, Test Bank, and Lecture Slides will specifically support <i>College Success Concise</i>.</p>"
Concepts of Biology,"<p data-block-key=""2nvyi""><i>Concepts of Biology</i> is designed for the typical introductory biology course for nonmajors, covering standard scope and sequence requirements. The text includes interesting applications and conveys the major themes of biology, with content that is meaningful and easy to understand. The book is designed to demonstrate biology concepts and to promote scientific literacy.<br/><br/></p>"
Contemporary Mathematics,"<p data-block-key=""3uodr""><i>Contemporary Mathematics</i> is designed to meet the scope and sequence requirements for a liberal arts mathematics course. This resource provides stand-alone sections with a focus on showing relevance in the features as well as the examples, exercises, and exposition. <i>Contemporary Mathematics</i> integrates technology applications, projects, and highlights a diverse group of contributors to mathematics, statistics, and related fields.</p>"
Elementary Algebra,"<p data-block-key=""fp9d9""><i>Elementary Algebra</i> is designed to meet the scope and sequence requirements of a one-semester elementary algebra course. The book’s organization makes it easy to adapt to a variety of course syllabi. The text expands on the fundamental concepts of algebra while addressing the needs of students with diverse backgrounds and learning styles. Each topic builds upon previously developed material to demonstrate the cohesiveness and structure of mathematics.</p>"
Elementary Algebra 2e,"<p data-block-key=""dia9z""><i>Elementary Algebra 2e</i> is designed to meet scope and sequence requirements for a one-semester elementary algebra course. The book’s organization makes it easy to adapt to a variety of course syllabi. The text expands on the fundamental concepts of algebra while addressing the needs of students with diverse backgrounds and learning styles. Each topic builds upon previously developed material to demonstrate the cohesiveness and structure of mathematics.</p><p data-block-key=""cfq0e"">The second edition contains detailed updates and accuracy revisions to address comments and suggestions from users. Dozens of faculty experts worked through the text, exercises and problems, graphics, and solutions to identify areas needing improvement. Though the authors made significant changes and enhancements, exercise and problem numbers remain nearly the same in order to ensure a smooth transition for faculty. The first edition of <i>Elementary Algebra</i> by OpenStax is available in web view <a href=""https://openstax.org/books/elementary-algebra/pages/1-introduction"">here</a>.</p>"
Entrepreneurship,"<p data-block-key=""0ah1s"">This textbook is intended for use in introductory Entrepreneurship classes at the undergraduate level. Due to the wide range of audiences and course approaches, the book is designed to be as flexible as possible. Theoretical and practical aspects are presented in a balanced manner, and specific components such as the business plan are provided in multiple formats. <i>Entrepreneurship</i> aims to drive students toward active participation in entrepreneurial roles, and exposes them to a wide range of companies and scenarios.</p>"
Fizyka dla szkół wyższych. Tom 1,"<p data-block-key=""a4h0z""><i>Fizyka dla szkół wyższych. Tom 1</i> dopasowana jest pod względem zakresu i układu treści do typowych kursów wprowadzających z fizyki ogólnej opartych na analizie matematycznej. Podręcznik kładzie nacisk na powiązania między teorią a praktycznymi zastosowaniami, wyjaśniając zagadnienia fizyczne w ciekawy i zrozumiały sposób, lecz z zachowaniem niezbędnego rygoru matematycznego. Liczne, dobrze dobrane przykłady pokazują, jak podejść do zadania, jak wykorzystać wzory i wreszcie jak sprawdzić i uogólnić wynik. Pytania prosimy wysyłać na adres <a href=""mailto:kontakt@openstax.pl"">kontakt@openstax.pl</a>.<br/><br/><a href=""https://openstax.org/blog/openstax-partners-katalyst-deliver-free-textbooks-poland"">OpenStax has partnered with Katalyst Education</a> to bring free, peer-reviewed, openly licensed textbooks to Poland as part of a new effort to internationalize OpenStax’s free open textbook model. <i>Fizyka dla szkół wyższych</i> is the first Polish title to be published under this agreement. Click <a href=""https://openstax.org/details/books/university-physics-volume-1"">here</a> for the English version of University Physics Volume 1.</p><p data-block-key=""gxggl""></p>"
Fizyka dla szkół wyższych. Tom 2,"<p data-block-key=""korlh""><i>Fizyka dla szkół wyższych. Tom 2</i> dopasowana jest pod względem zakresu i układu treści do typowych kursów wprowadzających z fizyki ogólnej opartych na analizie matematycznej. Podręcznik kładzie nacisk na powiązania między teorią a praktycznymi zastosowaniami, wyjaśniając zagadnienia fizyczne w ciekawy i zrozumiały sposób, lecz z zachowaniem niezbędnego rygoru matematycznego. Liczne, dobrze dobrane przykłady pokazują, jak podejść do zadania, jak wykorzystać wzory i wreszcie jak sprawdzić i uogólnić wynik.<br/> Pytania prosimy wysyłać na adres <a href=""mailto:kontakt@openstax.pl"">kontakt@openstax.pl</a>.<br/><br/><br/><a href=""/blog/openstax-partners-katalyst-deliver-free-textbooks-poland"">OpenStax has partnered with Katalyst Education</a> to bring free, peer-reviewed, openly licensed textbooks to Poland as part of a new effort to internationalize OpenStax’s free open textbook model. <i>Fizyka dla szkół wyższych</i> is the first Polish title to be published under this agreement. Click <a href=""https://openstax.org/details/books/university-physics-volume-2"">here</a> for the English version of University Physics Volume 2.<br/><br/></p>"
Fizyka dla szkół wyższych. Tom 3,"<p data-block-key=""1a2kk""><i>Fizyka dla szkół wyższych. Tom 3</i> dopasowana jest pod względem zakresu i układu treści do typowych kursów wprowadzających z fizyki ogólnej opartych na analizie matematycznej. Podręcznik kładzie nacisk na powiązania między teorią a praktycznymi zastosowaniami, wyjaśniając zagadnienia fizyczne w ciekawy i zrozumiały sposób, lecz z zachowaniem niezbędnego rygoru matematycznego. Liczne, dobrze dobrane przykłady pokazują, jak podejść do zadania, jak wykorzystać wzory i wreszcie jak sprawdzić i uogólnić wynik.<br/> Pytania prosimy wysyłać na adres <a href=""mailto:kontakt@openstax.pl"">kontakt@openstax.pl</a>.<br/><br/><br/><a href=""/blog/openstax-partners-katalyst-deliver-free-textbooks-poland"">OpenStax has partnered with Katalyst Education</a> to bring free, peer-reviewed, openly licensed textbooks to Poland as part of a new effort to internationalize OpenStax’s free open textbook model. <i>Fizyka dla szkół wyższych</i> is the first Polish title to be published under this agreement. Click <a href=""https://openstax.org/details/books/university-physics-volume-3"">here</a> for the English version of University Physics Volume 3.<br/><br/></p>"
Intermediate Algebra,"<p data-block-key=""9sl5u""><i>Intermediate Algebra</i> is designed to meet the scope and sequence requirements of a one-semester intermediate algebra course. The book’s organization makes it easy to adapt to a variety of course syllabi. The text expands on the fundamental concepts of algebra while addressing the needs of students with diverse backgrounds and learning styles. The material is presented as a sequence of clear steps, building on concepts presented in prealgebra and elementary algebra courses.<br/></p>"
Intermediate Algebra 2e,"<p data-block-key=""xy3uj""><i>Intermediate Algebra 2e</i> is designed to meet the scope and sequence requirements of a one-semester intermediate algebra course. The book’s organization makes it easy to adapt to a variety of course syllabi. The text expands on the fundamental concepts of algebra while addressing the needs of students with diverse backgrounds and learning styles. The material is presented as a sequence of clear steps, building on concepts presented in prealgebra and elementary algebra courses.</p><p data-block-key=""zkk6b"">The second edition contains detailed updates and accuracy revisions to address comments and suggestions from users. Dozens of faculty experts worked through the text, exercises and problems, graphics, and solutions to identify areas needing improvement. Though the authors made significant changes and enhancements, exercise and problem numbers remain nearly the same in order to ensure a smooth transition for faculty. The first edition of <i>Intermediate Algebra</i> by OpenStax is available in web view <a href=""https://openstax.org/books/intermediate-algebra/pages/1-introduction"">here</a>.</p>"
Introduction to Anthropology,"<p data-block-key=""w79j8"">Designed to meet the scope and sequence of your course, OpenStax <i>Introduction to Anthropology</i> is a four-field text integrating diverse voices, engaging field activities, and meaningful themes like Indigenous experiences and social inequality to engage students and enrich learning. The text showcases the historical context of the discipline, with a strong focus on anthropology as a living and evolving field.  There is significant discussion of recent efforts to make the field more diverse—in its practitioners, in the questions it asks, and in the applications of anthropological research to address contemporary challenges.  In addressing social inequality, the text drives readers to consider the rise and impact of social inequalities based on forms of identity and difference (such as gender, ethnicity, race, and class) as well as oppression and discrimination. The contributors to and dangers of socioeconomic inequality are fully addressed, and the role of inequality in social dysfunction, disruption, and change is noted.</p><p data-block-key=""9ciut"">If you have encountered a white screen while accessing your OpenStax textbook, our developers suggest closing all of your <a href=""http://openstax.org/"">OpenStax.org</a> tabs and then loading the book again.</p>"
Introduction to Business,"<p data-block-key=""0aby6""><i>Introduction to Business</i> covers the scope and sequence of most introductory business courses. The book provides detailed explanations in the context of core themes such as customer satisfaction, ethics, entrepreneurship, global business, and managing change. Introduction to Business includes hundreds of current business examples from a range of industries and geographic locations, which feature a variety of individuals. The outcome is a balanced approach to the theory and application of business concepts, with attention to the knowledge and skills necessary for student success in this course and beyond.</p>"
Introduction to Philosophy,"<p data-block-key=""3z0sx"">Designed to meet the scope and sequence of your course, <i>Introduction to Philosophy</i> surveys logic, metaphysics, epistemology, theories of value, and history of philosophy thematically. To provide a strong foundation in global philosophical discourse, diverse primary sources and examples are central to the design, and the text emphasizes engaged reading, critical thinking, research, and analytical skill-building through guided activities.</p>"
Introduction to Political Science,"<p data-block-key=""iq4ed"">Designed to meet the scope and sequence of your course, OpenStax<i> Introduction to Political Science</i> provides a strong foundation in global political systems, exploring <i>how</i> and <i>why</i> political realities unfold. Rich with examples of individual and national social action, this text emphasizes students’ role in the political sphere and equips them to be active and informed participants in civil society. Learn more about what this free, <a href=""https://creativecommons.org/licenses/by/4.0/"">openly-licensed</a> textbook has to offer you and your students.</p><p data-block-key=""fgrk8""></p><p data-block-key=""3eei6"">If you have encountered a white screen while accessing your OpenStax textbook, our developers suggest closing all of your <a href=""http://openstax.org/"">OpenStax.org</a> tabs and then loading the book again.</p>"
Introduction to Intellectual Property,"<p data-block-key=""a9fyn""><i>Introduction to Intellectual Property</i> provides a clear, effective introduction to patents, copyright, trademarks, and trade secrets. The text may be used by students and instructors in formal courses, as well as those applying intellectual property considerations to entrepreneurship, marketing, law, computer science, engineering, design, or other fields. The luminaries involved with this project represent the forefront of knowledge and experience, and the material offers considerable examples and scenarios, as well as exercises and references.</p><p data-block-key=""q0z3f""><i>Introduction to Intellectual Property</i> was originally developed by the Michelson 20MM Foundation, released under the title <i>The Intangible Advantage.</i></p><p data-block-key=""61nxd""><b>Presented by Gary K. Michelson, M.D.</b></p>"
Introduction to Sociology,"<p data-block-key=""sqhge""><i>Introduction to Sociology</i> adheres to the scope and sequence of a typical, one-semester introductory sociology course. It offers comprehensive coverage of core concepts, foundational scholars, and emerging theories. The textbook presents section reviews with rich questions, discussions that help students apply their knowledge, and features that draw learners into the discipline in meaningful ways. The second edition has been updated significantly to reflect the latest research and current, relevant examples.<br/></p>"
Introduction to Sociology 2e,"<p data-block-key=""yxpbg""><i>Introduction to Sociology 2e</i> adheres to the scope and sequence of a typical, one-semester introductory sociology course. It offers comprehensive coverage of core concepts, foundational scholars, and emerging theories. The textbook presents section reviews with rich questions, discussions that help students apply their knowledge, and features that draw learners into the discipline in meaningful ways. The second edition has been updated significantly to reflect the latest research and current, relevant examples.<br/></p><p data-block-key=""xi0qz"">Changes made in<i> Introduction to Sociology 2e</i> are described in the preface to help instructors transition to the second edition. The first edition of <i>Introduction to Sociology</i> by OpenStax is available in web view <a href=""http://cnx.org/contents/afe4332a-c97f-4fc4-be27-4e4d384a32d8/Introduction-to-Sociology"">here</a>.</p>"
Introduction to Sociology 3e,"<p data-block-key=""q7jxd""><i>Introduction to Sociology 3e</i> aligns to the topics and objectives of many introductory sociology courses. It is arranged in a manner that provides foundational sociological theories and contexts, then progresses through various aspects of human and societal interactions. The new edition is focused on driving meaningful and memorable learning experiences related to critical thinking about society and culture. The text includes comprehensive coverage of core concepts, discussions and data relevant to a diverse audience, and features that draw learners into the discipline in powerful and personal ways. Overall, <i>Introduction to Sociology 3e</i> aims to center the course and discipline as crucial elements for understanding relationships, society, and civic engagement; the authors seek to lay the foundation for students to apply what they learn throughout their lives and careers.<br/><br/></p><p data-block-key=""s4v55"">The authors, reviewers, and the entire team worked to build understanding of the causes and impacts of discrimination and prejudice. <i>Introduction to Sociology 3e</i> contains dozens of examples of discrimination and its outcomes regarding social science, society, institutions, and individuals. The text seeks to strike a balance between confronting the damaging aspects of our culture and history and celebrating those who have driven change and overcome challenges. The core discussion of these topics are present in Chapter 11 on Race and Ethnicity, and Chapter 12 on Gender, Sex, and Sexuality, but their causes and effects are extensively discussed in the context of other topics, including education, law enforcement, government, healthcare, the economy, and so on. Together and when connected by an instructor, these elements have potential for deep and lasting effects.<br/></p><p data-block-key=""8i3tn"">Changes made in <i>Introduction to Sociology 3e</i> are described in the preface to help instructors transition to the third edition. The second edition of <i>Introduction to Sociology</i> by OpenStax is available in web view <a href=""https://openstax.org/books/introduction-sociology-2e/pages/1-introduction-to-sociology"">here</a>.</p>"
Introductory Business Statistics,"<p data-block-key=""6f7uk""></p><p data-block-key=""jlr8o""></p><p data-block-key=""up0en""></p><p data-block-key=""wc0bq""><i>Introductory Business Statistics</i> is designed to meet the scope and sequence requirements of the one-semester statistics course for business, economics, and related majors. Core statistical concepts and skills have been augmented with practical business examples, scenarios, and exercises. The result is a meaningful understanding of the discipline, which will serve students in their business careers and real-world experiences.</p><p data-block-key=""7a1y1""></p><p data-block-key=""wc53y""></p><p data-block-key=""lzv4o""></p>"
